{
  "kind": "scheme-tokens/compiled-scheme",
  "formatVersion": 2,
  "modes": ["light", "dark"],
  "defaultMode": "light",
  "tokens": {
    "button.background": {
      "light": "#6750a4",
      "dark": "#d0bcff"
    },
    "button.foreground": {
      "light": "#ffffff",
      "dark": "#381e72"
    }
  },
  "metadataByToken": {
    "button.background": {
      "visibility": "public",
      "declarations": [
        {
          "origin": {
            "kind": "graph"
          },
          "visibility": "public"
        }
      ],
      "expressionByMode": {
        "light": {
          "ref": "brand.primary"
        },
        "dark": {
          "ref": "brand.primary"
        }
      }
    },
    "button.foreground": {
      "visibility": "public",
      "declarations": [
        {
          "origin": {
            "kind": "graph"
          },
          "visibility": "public"
        }
      ],
      "expressionByMode": {
        "light": {
          "ref": "brand.on-primary"
        },
        "dark": {
          "ref": "brand.on-primary"
        }
      }
    }
  }
}
